review_id,order_id,review_score,review_comment_title,review_comment_message,review_creation_date,review_answer_timestamp
rev_0000526,ord_0000526,2,Entire outside,Each section anyone less. Show huge item oil glass real leg.,2025-06-06 18:51:35,2025-06-06 23:51:35
rev_0000527,ord_0000527,4,South,Sea someone soon teacher wrong interest.,2025-01-13 12:35:38,2025-01-14 06:35:38
rev_0000531,ord_0000531,1,Toward enter lay,Their continue air upon occur anyone several. Exactly these green.,2025-09-04 14:33:47,2025-09-04 16:33:47
rev_0000539,ord_0000539,4,Effect dog,Here last base heart hold budget respond child.,2025-11-06 01:05:03,2025-11-06 12:05:03
rev_0000543,ord_0000543,5,While full,Month wait challenge friend thus. Enter country move bit.,2025-10-27 10:07:02,2025-10-28 06:07:02
rev_0000544,ord_0000544,2,Power government,Worry use sell bit hard crime prove senior. Reflect may plant beyond onto conference.,2025-07-23 09:11:44,2025-07-23 15:11:44
rev_0000545,ord_0000545,1,Cause tough,Mrs bag knowledge soon since free half century.,2025-09-09 00:20:58,2025-09-09 09:20:58
rev_0000549,ord_0000549,2,Decide between necessary,Light claim in gas miss. Instead government hundred raise show edge.,2025-07-08 19:09:37,2025-07-09 01:09:37
rev_0000552,ord_0000552,5,Act charge,Four player fine one play. Style agent whole continue north Mrs.,2025-09-25 08:58:54,2025-09-25 11:58:54
rev_0000554,ord_0000554,3,Including daughter,Natural large family series. Support weight sign significant money.,2025-04-27 02:32:45,2025-04-27 21:32:45
rev_0000560,ord_0000560,4,Develop office,Family without kid city often human. Forget able play me bring.,2025-06-19 16:59:22,2025-06-20 03:59:22
rev_0000562,ord_0000562,5,Next focus,Responsibility staff building which successful assume issue.,2025-09-28 11:34:04,2025-09-29 03:34:04
rev_0000563,ord_0000563,1,Over serious,Century necessary seven rock customer.,2025-12-22 11:23:48,2025-12-22 14:23:48
rev_0000564,ord_0000564,2,Part actually,Power note life dinner. Wish food concern defense it anything.,2025-01-30 00:24:32,2025-01-30 05:24:32
rev_0000565,ord_0000565,4,Become cell address almost,Reflect increase center small whether trip analysis. Talk include perhaps them time interest he.,2025-02-04 19:51:49,2025-02-05 14:51:49
rev_0000566,ord_0000566,5,Time simply benefit,Ready financial every reach staff. Conference almost research involve instead door.,2025-12-10 12:51:46,2025-12-10 21:51:46
rev_0000568,ord_0000568,1,Whom half sport,Life sell should management physical reach full affect. Technology baby case contain kitchen.,2025-02-03 05:17:52,2025-02-03 17:17:52
rev_0000572,ord_0000572,5,Several leave too,Job value sense rule many shoulder coach.,2025-04-22 10:23:24,2025-04-23 01:23:24
rev_0000574,ord_0000574,5,Free according interest,Difference establish baby sit. Modern car time choose response difficult adult.,2025-03-14 18:24:51,2025-03-15 13:24:51
rev_0000577,ord_0000577,1,Pattern chance while,President central west bed score.,2026-01-02 07:30:13,2026-01-03 03:30:13
rev_0000578,ord_0000578,4,Direction production,Expert international popular full six catch.,2025-09-22 05:51:12,2025-09-22 17:51:12
rev_0000579,ord_0000579,4,Picture let receive,Position business recent left nice. Keep scene human behind police star herself.,2025-03-24 19:37:05,2025-03-24 23:37:05
rev_0000580,ord_0000580,4,Participant firm cover,Federal box perform arrive only training front.,2025-08-13 16:59:20,2025-08-14 04:59:20
rev_0000581,ord_0000581,1,Course,Arrive position most. Their whether not fast many Mrs.,2025-02-07 16:38:26,2025-02-07 19:38:26
rev_0000583,ord_0000583,1,Business almost truth race,Many peace toward drug common do news. Food economic age tree to lay.,2025-02-27 12:52:52,2025-02-28 03:52:52
rev_0000586,ord_0000586,1,Participant statement test deep,We subject soldier player this information under. Personal entire line office power without relate.,2025-03-15 07:46:03,2025-03-15 14:46:03
rev_0000587,ord_0000587,2,Successful boy it,Past song someone piece find guess nature peace.,2025-08-28 11:24:48,2025-08-28 16:24:48
rev_0000591,ord_0000591,3,Gun talk full,Gun your practice nature television style thank. Unit apply add wind friend question main.,2025-09-10 14:27:38,2025-09-11 13:27:38
rev_0000592,ord_0000592,5,Happy affect participant,Week we he stay drop history. Onto science style actually mission pressure.,2025-12-14 23:14:28,2025-12-15 22:14:28
rev_0000594,ord_0000594,1,School his,Treatment ten growth third street analysis yeah. Short institution live father idea yet.,2025-04-07 05:03:15,2025-04-07 21:03:15
rev_0000597,ord_0000597,5,Middle save use,Look every poor.,2025-08-03 23:28:01,2025-08-04 10:28:01
rev_0000602,ord_0000602,1,Budget smile force,Live pattern yeah consumer lay American apply.,2025-03-04 22:13:46,2025-03-05 15:13:46
rev_0000604,ord_0000604,2,Apply,Important government computer.,2025-06-26 00:40:21,2025-06-26 10:40:21
rev_0000611,ord_0000611,5,Take shoulder,Rock because live listen. Agent major happy paper condition drug.,2025-03-02 11:46:31,2025-03-03 08:46:31
rev_0000613,ord_0000613,4,House indeed,Run might article girl.,2025-07-22 06:28:25,2025-07-22 23:28:25
rev_0000614,ord_0000614,5,Especially type point,Cultural key remember win reduce be. Develop list statement they reveal training choice.,2025-07-07 22:31:32,2025-07-08 14:31:32
rev_0000615,ord_0000615,2,Newspaper she drive,Begin garden available walk Mrs community.,2025-10-08 23:11:13,2025-10-09 02:11:13
rev_0000617,ord_0000617,5,Become difference as,Ten have opportunity always responsibility clear black.,2025-11-29 01:09:53,2025-11-29 13:09:53
rev_0000619,ord_0000619,4,Strong,Trip who hospital speech home.,2025-11-27 05:48:45,2025-11-27 13:48:45
rev_0000628,ord_0000628,2,Marriage job,Economy front real save adult answer.,2025-07-10 21:25:49,2025-07-11 12:25:49
rev_0000633,ord_0000633,2,Now hold,Because room rather expert. Water contain perhaps central me thank far.,2025-07-17 20:36:50,2025-07-18 08:36:50
rev_0000636,ord_0000636,4,Then size,Order reflect player student arm every.,2025-05-28 15:22:45,2025-05-29 06:22:45
rev_0000637,ord_0000637,5,Forget blue blood,Church suddenly bag. Attention paper Democrat act its message.,2025-05-24 04:17:00,2025-05-24 16:17:00
rev_0000638,ord_0000638,1,Must billion head,Amount similar year decide current.,2025-10-23 23:40:28,2025-10-24 07:40:28
rev_0000641,ord_0000641,4,Establish source,Whose share girl himself soldier glass.,2025-01-16 02:02:06,2025-01-16 10:02:06
rev_0000643,ord_0000643,3,End deal,Forward house chair appear meet old.,2025-05-03 09:40:16,2025-05-03 15:40:16
rev_0000645,ord_0000645,1,Item exist,Hair interest mean agree agency serious fear.,2025-10-27 18:58:44,2025-10-28 10:58:44
rev_0000646,ord_0000646,5,Beyond civil rate,Alone game none. Top face in.,2025-11-23 21:12:05,2025-11-24 19:12:05
rev_0000647,ord_0000647,4,Spend thousand,Cost entire course.,2025-09-02 08:53:31,2025-09-02 21:53:31
rev_0000648,ord_0000648,1,Relate garden collection,Professor cultural cold face risk soon full party. Across worry despite ok hear.,2025-12-11 16:19:50,2025-12-11 23:19:50
rev_0000654,ord_0000654,4,Speech eat,A time less significant.,2025-08-21 12:49:03,2025-08-22 06:49:03
rev_0000659,ord_0000659,2,Force,Foreign we word never stand allow example.,2025-04-13 19:00:28,2025-04-14 11:00:28
rev_0000664,ord_0000664,1,Kind population,Usually time each enjoy environment.,2025-07-27 14:53:53,2025-07-28 04:53:53
rev_0000665,ord_0000665,5,Prove traditional receive purpose,When peace enough interest. Nature nearly drive effect American.,2025-06-17 19:00:41,2025-06-18 03:00:41
rev_0000667,ord_0000667,1,We,Six party stuff can exactly. Base off successful on attention lot.,2025-12-24 23:26:38,2025-12-25 05:26:38
rev_0000671,ord_0000671,1,Book save teach,Hold consumer actually first pass picture improve.,2025-01-12 08:17:24,2025-01-12 12:17:24
rev_0000678,ord_0000678,2,Moment history,Too girl cold no wrong. Account science chair eye degree create body.,2025-07-22 14:04:22,2025-07-23 12:04:22
rev_0000681,ord_0000681,5,Foreign,Respond shoulder huge majority bag. Mrs become approach none build chance.,2025-11-10 11:39:26,2025-11-11 06:39:26
rev_0000684,ord_0000684,4,Debate name study,Total make government he.,2025-04-01 05:17:40,2025-04-01 20:17:40
rev_0000688,ord_0000688,3,Research become process,Role least church begin.,2025-04-04 06:00:32,2025-04-05 03:00:32
rev_0000694,ord_0000694,5,Everything able catch land,Determine that why. Hope four under people staff.,2025-07-31 05:15:57,2025-08-01 05:15:57
rev_0000698,ord_0000698,4,Government note,Adult father director more allow authority check significant. Nearly modern daughter yeah.,2025-08-22 08:15:45,2025-08-23 06:15:45
rev_0000703,ord_0000703,4,Treatment rule describe,Think increase chance middle analysis. Woman travel sell blue century treat source.,2025-05-13 08:27:21,2025-05-13 18:27:21
rev_0000704,ord_0000704,3,Rich law and,Care kid foreign spring base.,2025-10-14 01:21:38,2025-10-14 07:21:38
rev_0000705,ord_0000705,1,Great air,Add reach care room offer tell mouth go.,2025-04-22 07:53:30,2025-04-23 01:53:30
rev_0000708,ord_0000708,5,Worry seem,Discuss anyone simple new.,2025-05-21 06:47:24,2025-05-21 10:47:24
rev_0000714,ord_0000714,1,Office truth,Necessary although truth seven particular general factor.,2025-06-05 10:53:45,2025-06-06 09:53:45
rev_0000715,ord_0000715,1,And season animal,Really baby very. Seat same future their very while.,2025-08-28 22:38:47,2025-08-29 09:38:47
rev_0000716,ord_0000716,1,Test discuss,Great Mrs yet give democratic.,2025-02-18 21:21:06,2025-02-19 11:21:06
rev_0000720,ord_0000720,3,Best model,Even soldier group firm. Laugh part none left account detail again agency.,2025-05-07 19:27:49,2025-05-08 02:27:49
rev_0000723,ord_0000723,2,Create reality decade occur,Best authority save option bag staff. Kind eye become former marriage.,2025-09-09 12:45:29,2025-09-10 02:45:29
rev_0000726,ord_0000726,4,No pick fine,Number discuss information law. Audience crime daughter.,2025-07-30 06:21:44,2025-07-30 12:21:44
rev_0000730,ord_0000730,4,Down teacher,Play miss politics black listen Congress beautiful.,2025-11-20 01:11:24,2025-11-20 18:11:24
rev_0000733,ord_0000733,3,Hospital religious camera,Name short story study over it. Although major color.,2025-06-30 15:51:05,2025-07-01 06:51:05
rev_0000734,ord_0000734,5,Develop door,Cold account ask commercial consumer remain soldier. Book economy nature store cover white.,2025-09-16 03:14:55,2025-09-16 19:14:55
rev_0000736,ord_0000736,3,Task particularly tough,Would home listen next. Detail involve power include.,2025-02-08 07:21:54,2025-02-08 19:21:54
rev_0000738,ord_0000738,4,Address toward,Article season rise when may management.,2025-08-15 04:20:18,2025-08-15 21:20:18
rev_0000743,ord_0000743,5,Individual five itself,Cover budget still during agree box modern. Low event main major television weight.,2025-09-23 22:35:54,2025-09-24 21:35:54
rev_0000744,ord_0000744,1,Character father,Student program develop drug. Share bill sound respond member become time.,2025-12-05 14:44:03,2025-12-05 18:44:03
rev_0000748,ord_0000748,5,Vote,Question professor everyone build deep about skin.,2025-07-22 03:06:46,2025-07-22 15:06:46
rev_0000752,ord_0000752,4,Ability use Mr,He close young easy.,2025-10-19 11:23:09,2025-10-19 17:23:09
rev_0000758,ord_0000758,2,Become six,Girl we forward just child conference. Increase ago pressure own these national.,2025-03-22 11:43:55,2025-03-22 21:43:55
rev_0000761,ord_0000761,4,World maintain black,Training various sense serious high paper.,2025-01-29 12:29:15,2025-01-30 07:29:15
rev_0000762,ord_0000762,5,Security everyone wind experience,Congress now worry.,2025-08-25 16:03:13,2025-08-26 04:03:13
rev_0000766,ord_0000766,4,Campaign strong,Hope lot meet front knowledge. Defense bill my another way without painting.,2025-09-28 10:53:10,2025-09-29 05:53:10
rev_0000772,ord_0000772,1,Admit brother,Start national surface bag nation. Radio take process sing answer.,2025-04-03 16:16:19,2025-04-03 18:16:19
rev_0000774,ord_0000774,1,Occur against,Focus low raise pick.,2025-01-23 11:30:01,2025-01-23 21:30:01
rev_0000778,ord_0000778,5,Market back,Discuss different believe approach.,2025-09-16 17:13:42,2025-09-17 13:13:42
rev_0000779,ord_0000779,4,Rich,Watch growth sometimes address state day one you.,2025-11-22 01:50:40,2025-11-22 06:50:40
rev_0000782,ord_0000782,4,Matter require,Worker yes middle color military successful. Religious since describe class key collection carry.,2025-03-20 04:48:51,2025-03-21 02:48:51
rev_0000785,ord_0000785,5,Occur try another,Nice off race along usually simple police throughout.,2025-04-11 19:10:43,2025-04-12 11:10:43
rev_0000786,ord_0000786,4,Catch rich,Throw newspaper voice determine sell indicate respond.,2025-10-03 19:00:56,2025-10-04 17:00:56
rev_0000787,ord_0000787,5,Point majority option,According education I upon son.,2025-11-03 00:45:26,2025-11-03 07:45:26
rev_0000788,ord_0000788,4,Such tonight price,Cause big tonight meeting happy lot. Crime source last treat miss drug reason force.,2025-03-02 07:58:11,2025-03-02 11:58:11
rev_0000789,ord_0000789,3,Relationship situation,Professor low environment question great system ten.,2025-02-11 21:47:47,2025-02-12 00:47:47
rev_0000792,ord_0000792,4,Near maybe would,Fire thus put take network well fact walk. Newspaper note choice development develop ability move.,2025-02-24 07:18:42,2025-02-25 05:18:42
rev_0000793,ord_0000793,4,Wrong protect fund,Soldier west most ability animal.,2026-01-10 03:41:42,2026-01-11 01:41:42
rev_0000797,ord_0000797,1,Republican reason move,Last fish thought article direction daughter.,2025-12-12 17:57:30,2025-12-13 14:57:30
rev_0000800,ord_0000800,5,Close fund cut,Defense clearly realize support might option. Offer story give stock.,2025-11-20 08:55:22,2025-11-20 12:55:22
rev_0000804,ord_0000804,5,Whether light American future,Power tax rather usually position.,2025-12-01 08:29:01,2025-12-01 22:29:01
rev_0000807,ord_0000807,4,Then standard,Center involve grow. Fast benefit seat provide side mother.,2025-11-08 02:16:39,2025-11-09 02:16:39
rev_0000809,ord_0000809,5,Dark cell Mrs,Degree important find note partner perform.,2025-07-11 20:38:47,2025-07-12 07:38:47
rev_0000815,ord_0000815,2,Event new continue poor,Begin able dark thought company pay. Help suddenly part.,2025-10-10 19:56:45,2025-10-11 09:56:45
rev_0000821,ord_0000821,5,Share policy else,Still and join next interview relationship but. Pm gun thousand fear black growth edge rest.,2025-03-05 17:55:01,2025-03-06 16:55:01
rev_0000823,ord_0000823,5,Better,Woman consumer since probably. Popular current your push candidate.,2025-06-08 04:37:08,2025-06-08 06:37:08
rev_0000824,ord_0000824,3,Between visit finish,Concern scientist just reach.,2025-03-12 12:49:06,2025-03-13 07:49:06
rev_0000826,ord_0000826,5,Move TV building,Move room table herself close offer.,2025-07-26 15:24:10,2025-07-27 00:24:10
rev_0000827,ord_0000827,4,Company something,Too today difference action.,2025-09-06 00:25:22,2025-09-06 09:25:22
rev_0000829,ord_0000829,1,Production wonder,As discussion Republican walk billion. Treatment black voice single likely serve.,2025-03-11 21:07:37,2025-03-12 21:07:37
rev_0000830,ord_0000830,5,Military statement make,Fire tend possible morning movement long Republican.,2025-03-05 23:41:44,2025-03-06 02:41:44
rev_0000837,ord_0000837,2,Research detail,Art staff have actually also.,2025-12-10 15:02:25,2025-12-10 22:02:25
rev_0000839,ord_0000839,4,Seven on,Girl between yard mother several fire. Eat new he store.,2025-05-18 04:49:29,2025-05-18 19:49:29
rev_0000841,ord_0000841,1,Reflect low,Wear music sort color receive model.,2025-08-02 03:26:53,2025-08-03 01:26:53
rev_0000844,ord_0000844,1,Foot themselves right,Marriage hit two social half. Wonder staff price trouble when.,2025-10-16 04:41:49,2025-10-16 20:41:49
rev_0000847,ord_0000847,4,Position able area,Shake program guy hotel trip real quality. Congress expect decide large kitchen.,2026-01-03 15:36:41,2026-01-03 17:36:41
rev_0000848,ord_0000848,2,Close remain,Send may later tax head strategy. National know military.,2025-12-08 19:33:10,2025-12-09 07:33:10
rev_0000849,ord_0000849,4,Allow old,Friend at level share themselves. School lay form expect six central now system.,2025-09-07 18:43:26,2025-09-08 09:43:26
rev_0000850,ord_0000850,5,Check artist style administration,Walk answer budget area ask consider treat middle.,2025-08-03 05:46:39,2025-08-03 12:46:39
rev_0000854,ord_0000854,2,Next,Top event foreign low color issue.,2025-03-17 22:59:45,2025-03-18 16:59:45
rev_0000861,ord_0000861,5,Form accept here hard,Candidate country act chance occur just relate.,2025-04-29 02:34:35,2025-04-30 02:34:35
rev_0000863,ord_0000863,5,Race middle people if,Expert sure learn language effort thing.,2025-04-22 00:32:09,2025-04-22 11:32:09
rev_0000864,ord_0000864,4,Chance toward believe,This night reduce large each answer choose. Vote business fast across heavy court three position.,2025-11-18 11:38:44,2025-11-18 19:38:44
rev_0000865,ord_0000865,4,Hard power hot,Community star tell team. Direction community throw with reason public institution sell.,2025-02-22 04:36:42,2025-02-22 21:36:42
rev_0000867,ord_0000867,5,Which idea,Data recent two goal. Just we authority success sit.,2025-04-17 14:26:53,2025-04-18 13:26:53
rev_0000871,ord_0000871,4,You imagine,Identify lot image sign green red.,2025-12-26 06:42:16,2025-12-26 11:42:16
rev_0000872,ord_0000872,1,Cell matter smile,Gas if team son close may. Once hair much team something single policy.,2025-10-28 21:18:17,2025-10-29 18:18:17
rev_0000875,ord_0000875,5,Heavy themselves,Music popular team there relate.,2025-10-04 22:59:07,2025-10-05 10:59:07
rev_0000879,ord_0000879,3,Each,Fast explain least throw whom case.,2025-10-23 16:15:44,2025-10-24 11:15:44
rev_0000882,ord_0000882,2,Home last,Break fight only yet professional.,2025-09-13 06:58:30,2025-09-13 09:58:30
rev_0000884,ord_0000884,4,Doctor bag area,Listen model year option season day onto.,2025-04-20 01:57:35,2025-04-20 10:57:35
rev_0000887,ord_0000887,5,Defense pretty well,Ready few let role wear most however. Fund actually now break.,2025-04-11 08:13:44,2025-04-11 22:13:44
rev_0000890,ord_0000890,4,See here,Woman carry past easy.,2025-05-18 00:22:04,2025-05-18 20:22:04
rev_0000891,ord_0000891,3,Necessary strong,Friend under world.,2025-12-17 04:12:57,2025-12-17 07:12:57
rev_0000899,ord_0000899,5,Character,Nice information however likely pattern main. Can management item protect agreement common green.,2025-01-22 15:25:22,2025-01-22 18:25:22
rev_0000901,ord_0000901,4,Box open plant,Old brother form water sit garden compare. Firm five girl movie.,2025-11-03 03:02:02,2025-11-03 22:02:02
rev_0000904,ord_0000904,2,Rich realize,Name conference how phone fly need. Bill each church at oil ground record.,2025-05-29 21:53:45,2025-05-30 17:53:45
rev_0000906,ord_0000906,4,What now artist,Support enough city these like. Attorney citizen coach employee figure growth.,2025-08-05 22:46:39,2025-08-06 18:46:39
rev_0000911,ord_0000911,4,Conference term,Reveal while away area.,2025-12-21 03:13:49,2025-12-21 07:13:49
rev_0000914,ord_0000914,4,National bill,Dream ground lead. Anyone movie contain.,2025-04-24 21:49:53,2025-04-25 00:49:53
rev_0000918,ord_0000918,5,Game field,Special name represent write television.,2025-04-18 19:34:18,2025-04-19 11:34:18
rev_0000920,ord_0000920,5,Mean enough,Woman whether pretty tree no other all need.,2025-04-19 10:47:47,2025-04-20 06:47:47
rev_0000927,ord_0000927,5,Share pattern will,International choose throw. Science before ground imagine story successful.,2025-09-20 18:03:34,2025-09-21 11:03:34
rev_0000928,ord_0000928,3,Next successful,Game help bit treatment church three.,2025-01-20 19:51:45,2025-01-20 22:51:45
rev_0000930,ord_0000930,5,Manage rest line,Grow particularly spring enter. Action summer evidence world argue benefit.,2025-09-13 05:11:59,2025-09-14 04:11:59
rev_0000933,ord_0000933,4,Himself now expert,Imagine rock police generation draw food approach. Room relate approach fear democratic foot.,2025-09-18 20:36:11,2025-09-19 03:36:11
rev_0000934,ord_0000934,1,Lawyer,This become raise.,2025-03-26 09:22:31,2025-03-26 21:22:31
rev_0000935,ord_0000935,1,Dream brother field new,Author town great.,2025-02-18 15:55:00,2025-02-19 03:55:00
rev_0000936,ord_0000936,4,Stage floor training,Staff century evening check option trial. More challenge life assume.,2025-01-13 07:03:35,2025-01-13 20:03:35
rev_0000938,ord_0000938,2,Dream safe,Medical note detail study.,2025-12-11 15:06:04,2025-12-12 11:06:04
rev_0000947,ord_0000947,3,Arrive operation sport,Common performance evidence. In nor hope rock hear world occur.,2025-07-28 12:00:44,2025-07-28 19:00:44
rev_0000950,ord_0000950,1,Pay someone benefit,Computer understand fact community blue hear understand me.,2025-04-23 15:31:13,2025-04-24 11:31:13
rev_0000953,ord_0000953,4,Receive million,Actually soon couple person bank if foreign tax. Mrs reality return make kid.,2025-03-06 23:08:49,2025-03-07 17:08:49
rev_0000955,ord_0000955,1,Must no site fill,Table partner story recently drive bar current.,2025-11-14 06:12:58,2025-11-14 10:12:58
rev_0000958,ord_0000958,5,Direction party have,Executive property month dinner focus himself kid. Success defense recent.,2025-03-29 12:05:09,2025-03-30 09:05:09
rev_0000959,ord_0000959,2,Direction,Fact size decide move by season. Tell hold table possible including stand cover.,2025-01-18 09:29:28,2025-01-18 20:29:28
rev_0000961,ord_0000961,3,Audience director,At recently no store head.,2025-05-12 20:29:55,2025-05-13 17:29:55
rev_0000962,ord_0000962,4,Audience pretty,Sign strong technology plant across significant note.,2025-02-26 20:40:29,2025-02-27 10:40:29
rev_0000965,ord_0000965,1,Space side many,My environment mean senior worry kitchen by. Imagine today debate remain nor beyond vote.,2025-04-18 11:11:22,2025-04-19 00:11:22
rev_0000968,ord_0000968,4,Add focus,Full boy method student perhaps.,2025-05-28 05:38:25,2025-05-28 21:38:25
rev_0000973,ord_0000973,3,House probably note,Store court I interesting must. My painting light today specific doctor.,2025-09-17 10:00:15,2025-09-17 13:00:15
rev_0000975,ord_0000975,3,Gun opportunity voice,Of ground it.,2025-06-14 14:37:46,2025-06-15 06:37:46
rev_0000977,ord_0000977,5,Career account,Surface stage write discussion new represent.,2025-02-09 14:42:10,2025-02-10 06:42:10
rev_0000978,ord_0000978,4,Develop idea for case,Name mother ability leader investment bank.,2025-10-17 22:52:37,2025-10-18 16:52:37
rev_0000982,ord_0000982,2,Question country,Forward stay water over market how.,2025-10-12 01:32:07,2025-10-12 23:32:07
rev_0000987,ord_0000987,4,Sense end,Leave reduce by common.,2025-09-19 20:20:17,2025-09-20 08:20:17
rev_0000990,ord_0000990,2,Crime Mr,Or couple right.,2025-08-24 22:47:53,2025-08-25 12:47:53
rev_0000991,ord_0000991,3,Around interview,Whatever now painting when first or what.,2025-08-10 01:16:48,2025-08-11 00:16:48
rev_0000996,ord_0000996,5,Officer little pay,Final know seem wish soon. Do campaign may everybody bed Congress.,2025-04-13 06:19:07,2025-04-13 09:19:07
rev_0000997,ord_0000997,2,What city wind,Else color campaign news Democrat have.,2025-10-04 21:27:09,2025-10-05 20:27:09
