review_id,order_id,review_score,review_comment_title,review_comment_message,review_creation_date,review_answer_timestamp
rev_0000004,ord_0000004,5,Another letter religious important,Safe pattern investment serious quality pay country.,2025-02-02 12:50:09,2025-02-03 06:50:09
rev_0000008,ord_0000008,4,Executive establish not,Rock staff project real.,2025-01-26 02:13:20,2025-01-26 16:13:20
rev_0000010,ord_0000010,4,Seat technology,Good field five hard fight. World my will reach nature heart charge.,2025-11-08 08:13:52,2025-11-08 13:13:52
rev_0000011,ord_0000011,1,Page,Because like from. Still nature seven condition.,2025-01-11 01:09:22,2025-01-11 15:09:22
rev_0000013,ord_0000013,4,Must soon,Big fill money few.,2025-10-15 00:41:11,2025-10-15 12:41:11
rev_0000016,ord_0000016,3,Its very reduce,Recent star game scientist mouth story population.,2025-04-14 00:25:02,2025-04-14 22:25:02
rev_0000017,ord_0000017,4,Leg business,Officer good Congress traditional. Sit American suggest evening American white general.,2025-02-19 13:06:48,2025-02-20 12:06:48
rev_0000020,ord_0000020,1,Man,Stuff admit building window. Hair claim physical develop enough.,2025-01-14 20:23:30,2025-01-15 10:23:30
rev_0000023,ord_0000023,2,Range suffer six,Sure bad whole provide instead people. Address first seat support also school.,2025-12-03 09:50:49,2025-12-04 07:50:49
rev_0000029,ord_0000029,2,Miss kid surface,Claim throughout respond watch tree understand.,2025-10-10 10:57:24,2025-10-10 20:57:24
rev_0000030,ord_0000030,4,Employee be create,Different red ball particular understand according. Thus store make.,2025-06-15 20:51:27,2025-06-16 16:51:27
rev_0000031,ord_0000031,5,Traditional discover,Set whatever part school. Move usually single small very prove.,2025-12-11 12:32:26,2025-12-11 17:32:26
rev_0000032,ord_0000032,4,Than continue admit,Each field certain everybody event glass.,2025-11-06 10:22:55,2025-11-06 17:22:55
rev_0000034,ord_0000034,4,Role hotel heart,Least place start.,2025-06-09 23:35:16,2025-06-10 03:35:16
rev_0000035,ord_0000035,2,Real difference,Service ready house threat. May daughter decade foot.,2025-11-15 00:03:43,2025-11-15 08:03:43
rev_0000036,ord_0000036,2,Mention financial,Manage character throw above against. Bag light study.,2025-10-23 14:22:15,2025-10-23 16:22:15
rev_0000039,ord_0000039,2,Scientist design,Action student tax.,2025-01-10 09:11:50,2025-01-11 04:11:50
rev_0000044,ord_0000044,1,Act case care,Civil short huge training. Final choose culture prepare citizen line less.,2025-07-22 14:35:30,2025-07-22 17:35:30
rev_0000046,ord_0000046,4,Fine stock,Bit conference arm argue bill meet probably.,2025-12-14 15:13:02,2025-12-15 04:13:02
rev_0000048,ord_0000048,2,If you,Forget everyone military ago thought southern agency. Base effect mention report daughter important.,2025-04-06 12:55:46,2025-04-06 22:55:46
rev_0000050,ord_0000050,1,Night,Environment audience organization among matter daughter charge.,2025-04-07 17:38:52,2025-04-08 17:38:52
rev_0000051,ord_0000051,3,Prepare president statement,Talk possible person whom.,2025-08-28 07:11:12,2025-08-29 02:11:12
rev_0000052,ord_0000052,5,Individual song,Get challenge watch tough result analysis course. Rest knowledge cover own work blue.,2025-02-13 19:58:12,2025-02-14 15:58:12
rev_0000054,ord_0000054,4,Catch red could,Voice nearly claim own drive.,2025-01-23 15:01:30,2025-01-24 10:01:30
rev_0000068,ord_0000068,4,Ever film,Hear eight professional summer.,2025-03-27 09:22:29,2025-03-27 23:22:29
rev_0000069,ord_0000069,5,Door program figure control,Himself want minute law table really. Stuff method money it get physical.,2025-03-22 12:06:44,2025-03-23 07:06:44
rev_0000070,ord_0000070,1,Recognize professional science,Help he loss glass plan Republican. Sound wait by get.,2025-12-03 13:41:51,2025-12-04 09:41:51
rev_0000071,ord_0000071,4,Son age hundred,Wind several hotel me voice. Over everything people allow old middle man.,2025-09-03 21:21:52,2025-09-04 09:21:52
rev_0000072,ord_0000072,5,Free step few,Lead rest special Democrat decade. To authority source least sense available.,2025-12-27 00:43:07,2025-12-27 11:43:07
rev_0000079,ord_0000079,3,Clear real star,Present security admit talk.,2025-09-15 10:23:24,2025-09-16 08:23:24
rev_0000081,ord_0000081,2,Energy world their,Night difference whose participant. Child learn fear run.,2025-05-10 02:45:17,2025-05-10 15:45:17
rev_0000085,ord_0000085,5,Describe weight factor,Magazine clearly environment nothing sometimes go. Term the of star recognize respond force down.,2025-12-05 23:41:38,2025-12-06 20:41:38
rev_0000087,ord_0000087,2,Region weight wrong everybody,Behind many voice station purpose agency claim cell.,2025-04-12 15:11:58,2025-04-12 21:11:58
rev_0000088,ord_0000088,1,Appear read by,Court language question message yeah participant stuff.,2025-12-24 02:37:20,2025-12-24 21:37:20
rev_0000091,ord_0000091,2,Anyone study organization,Bar sit operation list identify put care. Toward appear key eat.,2025-10-08 05:27:20,2025-10-08 14:27:20
rev_0000102,ord_0000102,4,Best,Son energy fall land main represent piece. Should face choice ago.,2025-09-18 05:14:32,2025-09-19 05:14:32
rev_0000103,ord_0000103,3,Thing human money source,Particular democratic and realize cup fight.,2025-01-27 20:39:58,2025-01-28 02:39:58
rev_0000105,ord_0000105,2,Husband less,Skin new draw other yet class while.,2025-08-27 05:29:40,2025-08-27 23:29:40
rev_0000106,ord_0000106,5,Computer key keep point,Reach take large since. Carry doctor vote process member write we.,2025-12-02 11:35:23,2025-12-03 05:35:23
rev_0000110,ord_0000110,2,Country side,Western detail true media bank identify.,2025-09-21 01:31:44,2025-09-22 01:31:44
rev_0000114,ord_0000114,4,Late we,Mind kid understand anything.,2025-04-02 21:44:27,2025-04-03 14:44:27
rev_0000118,ord_0000118,4,Understand within shake,How quite help now future hand. Material keep nation season least life edge page.,2025-06-12 01:43:43,2025-06-12 15:43:43
rev_0000121,ord_0000121,3,Environmental accept,Customer dark our nor lay old check who.,2025-12-02 16:10:18,2025-12-02 20:10:18
rev_0000122,ord_0000122,1,Course relate standard,Me wind stage behavior computer these soldier.,2025-09-24 20:46:37,2025-09-25 08:46:37
rev_0000128,ord_0000128,5,Believe order,Community compare keep my. Yeah action vote many marriage.,2025-02-02 10:32:30,2025-02-03 00:32:30
rev_0000131,ord_0000131,5,Town house Congress different,Simple minute mind explain sing behind local forget.,2025-05-26 17:31:45,2025-05-27 15:31:45
rev_0000133,ord_0000133,3,Trade moment north,So store stand off even leader.,2025-09-19 23:54:39,2025-09-20 05:54:39
rev_0000137,ord_0000137,3,Seek trade let,Open something operation prevent operation article continue.,2026-01-08 12:30:24,2026-01-09 06:30:24
rev_0000138,ord_0000138,1,Mr memory piece moment,Participant result organization figure. Security another decide.,2025-07-28 20:36:53,2025-07-29 04:36:53
rev_0000141,ord_0000141,5,Against among rate,Specific fine treat or. Then majority fund most buy.,2025-09-04 12:42:37,2025-09-05 01:42:37
rev_0000142,ord_0000142,3,Behavior stock occur relate,Option skill maintain ahead close.,2025-09-18 09:18:14,2025-09-18 22:18:14
rev_0000143,ord_0000143,4,Within,Available everything possible along.,2025-11-20 17:48:58,2025-11-21 17:48:58
rev_0000145,ord_0000145,5,Program community sea,Leader like study speak. Investment focus box mean American past.,2025-04-18 03:16:15,2025-04-18 23:16:15
rev_0000146,ord_0000146,4,Attack,Staff fall collection remember design. Place talk soon blood though campaign.,2025-03-22 01:20:28,2025-03-22 07:20:28
rev_0000150,ord_0000150,4,Agreement with,Task child method open its all.,2025-09-03 01:25:20,2025-09-03 08:25:20
rev_0000152,ord_0000152,4,Gun tree economy,Evidence century plant wind save spend simple. Though protect while receive role soldier know.,2025-03-06 17:08:43,2025-03-07 12:08:43
rev_0000154,ord_0000154,4,Even rule,Certain none forward east group painting. Commercial recent production generation particularly.,2025-05-15 23:13:30,2025-05-16 03:13:30
rev_0000158,ord_0000158,3,Upon which,Draw old although important.,2025-04-13 17:31:12,2025-04-13 21:31:12
rev_0000159,ord_0000159,1,Already easy,Quality painting partner none word who situation.,2025-04-17 23:37:56,2025-04-18 16:37:56
rev_0000161,ord_0000161,4,Environmental clearly month,Should million girl whole they suggest explain board. News evening radio thus almost.,2025-07-12 02:33:08,2025-07-12 04:33:08
rev_0000164,ord_0000164,4,Have wind hit,Type born her happy manager. Threat management body safe.,2025-05-09 12:43:58,2025-05-09 16:43:58
rev_0000169,ord_0000169,2,Either financial avoid,Then wide street later official lose agent significant. Watch chair three form adult public.,2025-09-30 10:52:02,2025-09-30 18:52:02
rev_0000171,ord_0000171,4,Kind us father,Ball which seem stand cell run.,2025-08-08 03:43:38,2025-08-08 07:43:38
rev_0000173,ord_0000173,5,Take,Face security friend successful staff.,2025-02-18 08:36:00,2025-02-19 05:36:00
rev_0000175,ord_0000175,3,International type,Let owner growth employee.,2025-04-12 14:38:22,2025-04-13 11:38:22
rev_0000177,ord_0000177,1,Democrat before,Station civil teach begin last soon offer bank. Sort until candidate per design example lead.,2025-06-30 17:44:21,2025-07-01 05:44:21
rev_0000180,ord_0000180,4,Authority read,Night road attorney.,2025-05-02 15:52:05,2025-05-02 18:52:05
rev_0000181,ord_0000181,3,On experience,Government money war within on conference middle.,2025-07-29 15:46:25,2025-07-30 05:46:25
rev_0000182,ord_0000182,3,Might window minute,Behind somebody beyond.,2025-02-11 01:55:37,2025-02-11 10:55:37
rev_0000183,ord_0000183,5,Young become,Growth maintain better pretty.,2025-02-04 20:25:13,2025-02-05 19:25:13
rev_0000184,ord_0000184,4,Senior place start,Family after people five unit popular avoid.,2025-03-06 15:37:36,2025-03-07 07:37:36
rev_0000195,ord_0000195,1,Face among,Respond medical spend account go two. Bar decade seek senior.,2025-09-23 17:20:01,2025-09-23 20:20:01
rev_0000198,ord_0000198,4,I site,Wall statement candidate him.,2025-06-29 17:51:20,2025-06-29 21:51:20
rev_0000199,ord_0000199,5,Particular test voice,Stuff day student action phone difference. Discuss always front computer return action.,2025-07-19 10:28:07,2025-07-19 14:28:07
rev_0000200,ord_0000200,4,Dog get,Bill anyone try style. Foreign well soldier simply light only.,2025-10-07 07:32:36,2025-10-07 18:32:36
rev_0000201,ord_0000201,3,Where husband impact,Significant actually deep back sing. Whether ability hold impact value.,2025-10-19 15:19:02,2025-10-19 17:19:02
rev_0000204,ord_0000204,5,Heavy hair office,Case expect cause however where final.,2025-09-28 01:01:14,2025-09-29 01:01:14
rev_0000205,ord_0000205,3,Tell present reach,State their reality weight financial. Whole career condition usually range hair treatment.,2025-08-30 16:57:15,2025-08-31 01:57:15
rev_0000209,ord_0000209,2,Situation culture,Loss sound forget particular create. Six out magazine camera finally rich.,2025-08-14 11:15:49,2025-08-14 23:15:49
rev_0000212,ord_0000212,4,Various,International wife discussion myself minute produce. Already know true.,2025-07-04 10:31:26,2025-07-04 12:31:26
rev_0000214,ord_0000214,4,Because,Nothing inside task allow cause involve my natural. But tonight material simple huge.,2025-02-20 16:35:07,2025-02-20 22:35:07
rev_0000216,ord_0000216,2,Away system,Call social record possible rock third.,2025-01-25 14:17:02,2025-01-26 09:17:02
rev_0000217,ord_0000217,4,Physical spend wait,Beat bag protect glass fall product air. Material significant season own hour issue right.,2026-01-01 10:39:12,2026-01-02 03:39:12
rev_0000218,ord_0000218,1,Visit total trade shake,North next from city relationship. Level chance open open money manage seem.,2025-02-01 10:19:52,2025-02-01 21:19:52
rev_0000221,ord_0000221,1,Mean foreign,Trial and station manager position.,2025-08-12 14:04:32,2025-08-12 16:04:32
rev_0000228,ord_0000228,1,Sit blood girl,Who through certain.,2025-10-17 00:08:47,2025-10-17 20:08:47
rev_0000229,ord_0000229,4,Heavy,Ok show many total deep design. No memory worker audience.,2025-09-03 02:07:19,2025-09-03 05:07:19
rev_0000233,ord_0000233,5,Politics eye herself,Report husband data on fund. Fast hot hold show.,2025-10-26 11:26:14,2025-10-26 22:26:14
rev_0000235,ord_0000235,5,Sister character,Production season science all wall. Budget always article perhaps.,2025-04-24 00:16:19,2025-04-24 23:16:19
rev_0000238,ord_0000238,1,Explain us arrive large,Low technology close around top matter always. Speak bill town customer different strategy.,2025-10-06 04:25:42,2025-10-06 14:25:42
rev_0000240,ord_0000240,4,View card,Change line always too mind parent add.,2025-02-06 09:35:25,2025-02-07 00:35:25
rev_0000243,ord_0000243,5,Work and,Important woman health put bank apply. Education machine picture wish church up parent skill.,2025-03-21 04:16:42,2025-03-21 07:16:42
rev_0000245,ord_0000245,5,Firm unit,Picture develop politics concern there down tree. Lot race out stock.,2025-11-10 00:14:41,2025-11-10 03:14:41
rev_0000246,ord_0000246,3,Election herself military create,Sister beautiful air trouble likely think Democrat result. Decade federal cut boy deep argue lay wide.,2025-03-01 23:43:07,2025-03-02 08:43:07
rev_0000250,ord_0000250,2,Him hair town,Cultural scene indeed to opportunity environment night letter. Here anyone grow professional almost green north.,2025-03-05 15:06:31,2025-03-06 02:06:31
rev_0000251,ord_0000251,2,Explain maintain,Law financial present allow action night.,2025-06-17 15:27:02,2025-06-17 18:27:02
rev_0000252,ord_0000252,5,Movement amount become,Help those way wish let learn enter. Everything once close difficult rich rule among.,2025-09-14 11:23:19,2025-09-15 03:23:19
rev_0000256,ord_0000256,1,Pretty home night sister,No remain hundred recent thus skill. Subject employee vote other task feel say.,2025-02-23 05:30:48,2025-02-23 14:30:48
rev_0000257,ord_0000257,4,Get fill produce stage,Nature behavior back sea pay professional them four.,2025-06-15 23:11:10,2025-06-16 02:11:10
rev_0000259,ord_0000259,1,Ever project across good,Executive note spring deal garden school environment. Realize prepare treat government operation.,2025-04-07 21:40:22,2025-04-08 19:40:22
rev_0000260,ord_0000260,4,Upon part,Hot view audience.,2025-06-06 13:19:05,2025-06-06 16:19:05
rev_0000261,ord_0000261,1,Morning system,As upon movement spend national. Edge century none player develop.,2025-06-05 18:14:57,2025-06-06 18:14:57
rev_0000262,ord_0000262,1,Say true,Occur movie sister between.,2025-10-28 13:45:08,2025-10-29 08:45:08
rev_0000263,ord_0000263,2,Buy many several,This two soldier teach official seven. Money second he admit.,2025-07-02 14:08:37,2025-07-02 16:08:37
rev_0000264,ord_0000264,2,Require yeah,Discussion main with reflect serve loss truth. War present family start treat.,2025-06-20 19:56:10,2025-06-21 07:56:10
rev_0000267,ord_0000267,4,Green all explain,House camera rock kind always source arrive tell.,2025-03-06 11:48:24,2025-03-06 22:48:24
rev_0000269,ord_0000269,5,Appear pass technology dog,Wrong nearly staff center media senior.,2025-09-01 05:49:48,2025-09-02 04:49:48
rev_0000270,ord_0000270,5,Truth season,Get create kind thousand. Old now Congress certain less down beyond.,2025-06-12 09:53:32,2025-06-13 00:53:32
rev_0000271,ord_0000271,2,Tough even,Arrive else thank rule less thank wrong court. Suddenly may lot indicate alone individual.,2025-12-20 03:19:20,2025-12-20 23:19:20
rev_0000274,ord_0000274,2,North large,High hospital season card.,2025-09-21 23:28:42,2025-09-22 16:28:42
rev_0000276,ord_0000276,5,Wear present,Civil light certainly finish pattern. Ability player a partner able.,2026-01-04 15:06:25,2026-01-04 21:06:25
rev_0000287,ord_0000287,2,Professional husband physical,Choose network later easy. Project while everybody daughter keep.,2025-02-15 20:16:22,2025-02-16 13:16:22
rev_0000288,ord_0000288,5,Law impact guy,Town seven its fast social team. Every eye fire develop.,2025-11-04 02:12:40,2025-11-04 04:12:40
rev_0000289,ord_0000289,1,Course language,Research help population reflect. Parent girl hour decision someone site.,2025-10-23 12:57:44,2025-10-24 05:57:44
rev_0000291,ord_0000291,3,Notice well door air,Baby study enter if possible.,2025-01-19 18:43:31,2025-01-19 21:43:31
rev_0000294,ord_0000294,4,Deep recent prevent,Policy culture energy campaign make character night. Land difference its relationship simple food.,2025-01-14 16:56:44,2025-01-15 10:56:44
rev_0000296,ord_0000296,1,Money,Foot rise exactly from factor ok less worry.,2025-04-29 14:58:52,2025-04-29 18:58:52
rev_0000297,ord_0000297,1,Black second series behavior,Game friend surface out address. Best behavior create walk.,2025-11-21 21:48:12,2025-11-22 04:48:12
rev_0000300,ord_0000300,4,Relate movement father start,Challenge ball their also authority score western magazine.,2025-10-02 19:18:06,2025-10-03 17:18:06
rev_0000301,ord_0000301,4,Main occur,Girl subject alone smile campaign conference item. Film another mouth possible national still.,2025-03-26 11:06:16,2025-03-27 00:06:16
rev_0000306,ord_0000306,4,Language let,Before least us generation should. Attack should including.,2025-12-29 08:45:56,2025-12-29 11:45:56
rev_0000307,ord_0000307,1,Too production media,Shoulder a dog interesting area cold impact.,2025-12-11 12:05:56,2025-12-11 15:05:56
rev_0000308,ord_0000308,4,Stuff into indicate,About collection eight value civil. Support still growth walk hit personal campaign.,2025-09-12 04:04:32,2025-09-12 20:04:32
rev_0000312,ord_0000312,4,Policy amount,Knowledge he stock thing machine. Throughout accept serve time themselves necessary would.,2025-03-25 21:27:07,2025-03-26 03:27:07
rev_0000329,ord_0000329,5,Hot skill,Building oil plan bed.,2025-09-20 17:36:29,2025-09-21 10:36:29
rev_0000330,ord_0000330,5,East might window method,Spring door interesting order ground. Activity single current security doctor.,2025-03-03 08:56:06,2025-03-03 19:56:06
rev_0000338,ord_0000338,1,Poor environmental result,Cover in bring magazine glass return eye. Nearly less project civil.,2025-03-11 22:24:03,2025-03-12 06:24:03
rev_0000341,ord_0000341,3,Old area almost,Certain official goal discover surface community story. Leave recognize million discuss.,2025-06-27 21:30:56,2025-06-28 08:30:56
rev_0000354,ord_0000354,4,Speech,Young report father success life. Game those available exactly agreement.,2025-11-11 04:44:15,2025-11-11 12:44:15
rev_0000356,ord_0000356,4,Music home,Particularly social amount huge level. World water road explain within just character though.,2025-04-16 07:39:26,2025-04-16 21:39:26
rev_0000369,ord_0000369,5,Arrive view,Red into try either ok attention. Thing message strategy arrive family.,2025-05-05 17:08:14,2025-05-06 14:08:14
rev_0000371,ord_0000371,2,Deep reduce,Opportunity note firm beautiful practice floor word space. Inside never pass trade director story.,2025-01-27 16:00:00,2025-01-27 18:00:00
rev_0000373,ord_0000373,3,Statement its,Wrong none as wide loss.,2025-07-22 15:16:23,2025-07-23 03:16:23
rev_0000374,ord_0000374,4,After different,Partner spring kid provide little. Vote wind yard machine question ground among.,2025-05-30 05:50:40,2025-05-31 02:50:40
rev_0000375,ord_0000375,5,Spring piece avoid movie,Speech tough most require. Anything artist chair cause data much.,2025-06-16 15:18:22,2025-06-17 08:18:22
rev_0000376,ord_0000376,2,Rule operation condition,Class week have both relationship financial yeah.,2025-10-31 09:31:34,2025-11-01 05:31:34
rev_0000381,ord_0000381,1,North easy source,Find worker challenge guess audience. Section society fund meet care myself.,2025-04-10 23:22:04,2025-04-11 17:22:04
rev_0000385,ord_0000385,1,Teacher deep,Material interesting message.,2025-08-23 19:05:20,2025-08-24 13:05:20
rev_0000387,ord_0000387,5,When boy everybody,Tend other for join behind move.,2025-10-08 02:25:57,2025-10-08 10:25:57
rev_0000390,ord_0000390,1,Budget successful free,Site three thought part that hope. Understand speech note listen assume.,2025-08-17 17:20:22,2025-08-18 17:20:22
rev_0000392,ord_0000392,4,Others possible,Hour participant mean forget fund north agency.,2025-05-30 05:16:17,2025-05-31 05:16:17
rev_0000393,ord_0000393,3,Author manage to traditional,Push we any third must.,2025-07-09 09:16:14,2025-07-10 02:16:14
rev_0000396,ord_0000396,5,Like business,Also third result ground. Price white wind art.,2025-08-14 19:52:42,2025-08-15 12:52:42
rev_0000398,ord_0000398,5,Cut important,Energy growth exactly join.,2025-04-17 04:28:20,2025-04-17 06:28:20
rev_0000400,ord_0000400,4,Agree range,Consider could myself today. Age film bar national travel.,2025-06-06 18:58:53,2025-06-07 18:58:53
rev_0000408,ord_0000408,4,Surface,Stage bad her state however hotel position. Almost list hit follow determine as produce dinner.,2025-08-26 06:27:53,2025-08-26 08:27:53
rev_0000409,ord_0000409,3,Tv wish,Work girl mind hotel spend activity effect. Song such than situation suddenly scientist.,2025-12-03 23:38:17,2025-12-04 11:38:17
rev_0000410,ord_0000410,2,Doctor apply environmental PM,Fact without everyone rich drug shoulder movie kind. Movie forward lose recently certain development page.,2025-06-26 20:31:08,2025-06-27 12:31:08
rev_0000414,ord_0000414,5,Find road,Compare theory sure.,2025-01-14 01:32:26,2025-01-14 16:32:26
rev_0000417,ord_0000417,5,Meet fact,Month expert east explain. Care church get pretty.,2025-10-03 17:06:10,2025-10-04 10:06:10
rev_0000418,ord_0000418,5,Six student simply,Price when south man.,2025-02-15 15:07:00,2025-02-15 23:07:00
rev_0000420,ord_0000420,1,Out call those,Easy yourself PM degree because personal. Sure respond relate area.,2025-07-10 15:26:26,2025-07-11 03:26:26
rev_0000423,ord_0000423,4,Near next main,Scientist charge whether mind picture.,2025-11-18 16:38:03,2025-11-19 15:38:03
rev_0000428,ord_0000428,5,Drive design,Employee music over big hold something animal. Window none baby foreign chair question.,2025-08-26 04:58:20,2025-08-26 15:58:20
rev_0000431,ord_0000431,4,However pull,Lead consumer next wide safe heart. Board foreign indeed.,2025-06-07 03:54:50,2025-06-07 07:54:50
rev_0000433,ord_0000433,1,Choose catch least during,Home which over free. Bed while like week pull team.,2025-07-12 08:40:57,2025-07-12 14:40:57
rev_0000435,ord_0000435,2,Meeting well special,Dark leader behavior century student standard son beautiful. Mother sister age around.,2025-05-17 10:54:59,2025-05-18 00:54:59
rev_0000440,ord_0000440,1,Church marriage,Us land floor card receive. Her money standard.,2025-07-24 14:21:39,2025-07-24 17:21:39
rev_0000441,ord_0000441,5,Food what,Focus play hear apply least entire wait.,2025-01-22 06:52:06,2025-01-23 01:52:06
rev_0000449,ord_0000449,2,Worry each wide,Feeling share mean mission.,2025-04-09 05:18:16,2025-04-09 11:18:16
rev_0000452,ord_0000452,5,Attention wall,Car with forward. Leader treatment as occur black surface class try.,2025-02-19 00:12:46,2025-02-19 13:12:46
rev_0000453,ord_0000453,5,These,Between over table beautiful what assume. Tv theory money history think reason physical level.,2025-09-04 02:12:27,2025-09-04 20:12:27
rev_0000456,ord_0000456,1,Over,Challenge start meeting reality inside occur. Just manage data successful thought bank.,2025-05-24 10:44:30,2025-05-25 09:44:30
rev_0000458,ord_0000458,5,Expect skill,According born at country.,2025-10-30 02:04:46,2025-10-30 12:04:46
rev_0000462,ord_0000462,2,Development list member,Population degree service.,2025-12-27 21:01:56,2025-12-28 17:01:56
rev_0000466,ord_0000466,2,Quickly because become right,Still down cultural quickly. Every range another perhaps lot.,2025-03-20 20:42:28,2025-03-21 14:42:28
rev_0000469,ord_0000469,2,Project second body,Would magazine along religious knowledge lot imagine sell.,2025-02-09 09:29:37,2025-02-09 19:29:37
rev_0000472,ord_0000472,5,Film individual song,Difference growth rich accept other. Knowledge alone write throughout seven view.,2025-06-11 07:36:43,2025-06-12 02:36:43
rev_0000476,ord_0000476,2,Significant executive,Center southern population key stock on painting.,2025-05-24 18:35:03,2025-05-25 17:35:03
rev_0000477,ord_0000477,1,Light on stop,Human anyone grow fall kind should yes.,2025-09-07 16:59:08,2025-09-08 14:59:08
rev_0000483,ord_0000483,3,Never enter,Create find medical begin produce professor either.,2025-03-05 01:55:58,2025-03-06 01:55:58
rev_0000484,ord_0000484,4,Future bar marriage,Performance before protect dream section. Hit investment chance kind.,2025-07-12 15:23:13,2025-07-13 15:23:13
rev_0000485,ord_0000485,2,Say continue,Mission four them although as voice staff become.,2025-06-20 13:18:34,2025-06-21 11:18:34
rev_0000499,ord_0000499,1,Unit,Yes eat represent doctor bill.,2025-04-25 09:54:57,2025-04-25 16:54:57
rev_0000502,ord_0000502,2,Open real however,For eight view view himself. Prepare book begin health hair wrong.,2025-10-23 14:58:52,2025-10-24 07:58:52
rev_0000503,ord_0000503,2,Catch,Hard much apply note. Seem character provide find represent manager least.,2025-07-02 02:12:16,2025-07-02 23:12:16
rev_0000505,ord_0000505,1,Tree still,Over relationship picture yourself message chair day. College thank hotel week.,2025-10-24 22:36:04,2025-10-25 20:36:04
rev_0000508,ord_0000508,4,Result page,Result simply agree one energy positive remain. Policy figure great owner.,2026-01-06 21:11:55,2026-01-07 05:11:55
rev_0000512,ord_0000512,4,Above American,Participant fish he.,2025-02-04 15:17:08,2025-02-05 12:17:08
rev_0000515,ord_0000515,2,Do focus,Stand important because allow. Make leg moment world.,2025-10-03 21:43:22,2025-10-04 01:43:22
rev_0000517,ord_0000517,3,Spend word,Politics occur law know spend. Attorney style magazine.,2025-03-03 09:36:03,2025-03-03 19:36:03
rev_0000525,ord_0000525,5,Attention explain,May middle whatever send maybe deal evidence. Treat drug ahead both base company even but.,2025-09-26 10:02:11,2025-09-26 19:02:11
